,0
675, n friend PL prep with n joy adv so adv quick dadj LY coord and 
676, gra LINK SU J JCT SU J ROOT O J JCT
677, PO J JCT JCT CONJ PUNCT
678, mhm 
679, mor co yes 
680, gra INCROOT PUNCT
681, and I ve been here a whole semester and there s no one I m really
682, close to 
683, mor coord and pro sub I aux have cop be P STP adv here det art a
684, adj whole n semester coord and pro exist there cop be S qn no
685, pro indef one pro sub I cop be S adv real dadj LY adj close prep to
686, 
687, gra LINK SU J UX ROOT JCT DET MOD PRED
688, LINK SU J CMOD QU NT PRED SU J
689, CMOD JCT PRED JCT PUNCT
690, mhm 
691, mor co yes 
692, gra INCROOT PUNCT
693, and I ve tried 
694, mor coord and pro sub I aux have part try P STP 
695, gra LINK SU J UX ROOT PUNCT
696, mhm 
697, mor co yes 
698, gra INCROOT PUNCT
699, people are just aren t willing it s really strange 
700, mor n person PL aux be PRES adv just aux be PRES neg not adj willing
701, pro per it aux be S adv real dadj LY adj strange 
702, gra SU J UX JCT UX NEG ROOT SU J COMP
703, JCT PRED PUNCT
704, smacks lips 
705, well 
706, mor co well 
707, gra INCROOT PUNCT
708, you know sometimes you mix with a group and sometimes you just
709, don t but I 
710, mor pro per you v know adv sometimes pro per you v mix prep with
711, det art a n group coord and adv sometimes pro per you adv just
712, mod do neg not conj but pro sub I 
713, gra SU J ROOT JCT SU J COMP JCT DET
714, PO J CONJ COORD PO J JCT UX NEG
715, CONJ COORD PUNCT
716, I guess 
717, mor pro sub I v guess 
718, gra SU J ROOT PUNCT
719, but you know look at how 
720, mor conj but pro per you v know cop look prep at adv int how 
721, gra LINK SU J ROOT O J JCT PO J PUNCT
722, but Theta is gr I mean I ve I ve made more friends with with
723, people in Theta than I have 
724, mor conj but n prop Theta cop be S pro sub I v mean pro sub I aux have
725, pro sub I aux have part make P STP qn more n friend PL prep with
726, prep with n person PL prep in n prop Theta prep than pro sub I
727, v have 
728, gra LINK SU J CJCT SU J ROOT SU J UX
729, SU J UX COMP QU NT O J JCT
730, JCT PO J NJCT PO J NJCT SU J
731, CPO J PUNCT
732, well that s my point o obviously you know you and Theta chose
733, each other because you have a lot in common 
734, mor co well pro dem that cop be S det poss my n point
735, adv obvious dadj LY pro per you v know pro per you coord and
736, n prop Theta v choose P ST qn each qn other conj because pro per you
737, v have det art a n lot prep in adj common 
738, gra COM SU J ROOT MOD PRED JCT SU J
739, PRED SU J LINK SU J COMP QU NT
740, O J LINK SU J CJCT DET O J
741, JCT PO J PUNCT
742, you know dear 
743, mor pro per you v know co dear 
744, gra SU J ROOT O J PUNCT
745, yeah 
746, mor co yeah 
747, gra INCROOT PUNCT
748, and you know that s what s so nice about it it is you feel kind of
749, simpatico with them 
750, mor coord and pro per you v know pro rel that aux be S
751, pro int what aux be S adv so adj nice prep about pro per it
752, pro per it cop be S pro per you v feel n kind prep of adj simpatico
753, prep with pro obj them 
754, gra LINK SU J ROOT LINK UX SU J UX
755, JCT PRED JCT PO J SU J COMP
756, SU J PRED O J NJCT PO J JCT
757, PO J PUNCT
758, and um 
759, mor coord and 
760, gra INCROOT PUNCT
761, you know there s there s a a meshing there s a chemistry 
762, mor pro per you v know pro exist there aux be S
763, pro exist there cop be S det art a det art a n gerund mesh PRESP
764, pro exist there cop be S det art a n chemistry 
765, gra SU J SU J SU J UX SU J ROOT DET
766, DET PRED SU J CMOD DET PRED
767, PUNCT
768, right I really like them 
769, mor adv right pro sub I adv real dadj LY v like pro obj them 
770, gra JCT SU J JCT ROOT O J PUNCT
771, mhm 
772, mor co yes 
773, gra INCROOT PUNCT
774, I mean 
775, mor pro sub I v mean 
776, gra SU J ROOT PUNCT
777, not all of them are friendly but it s you know it s a huge house 
778, 
779, mor neg not pro indef all prep of pro obj them aux be PRES
780, adj friend dn LY conj but pro per it aux be S pro per you v know
781, pro per it cop be S det art a adj huge n house 
782, gra NEG SU J NJCT PO J UX LINK LINK
783, SU J UX SU J CJCT SU J ROOT
784, DET MOD PRED PUNCT
785, oh of course 
786, mor co oh prep of n course 
787, gra INCROOT JCT PO J PUNCT
788, so yeah it s really cool 
789, mor co so co yeah pro per it cop be S adv real dadj LY adj cool 
790, gra COM COM SU J ROOT JCT PRED PUNCT
791, so I think that um aren t you glad that you made the decision to
792, change 
793, mor co so pro sub I v think pro dem that aux be PRES neg not
794, pro per you adj glad pro rel that pro per you v make P ST
795, det art the n decision prep to n change 
796, gra COM SU J ROOT SU J UX NEG O J PRED
797, LINK SU J CMOD DET O J JCT
798, PO J PUNCT
799, mom I really am 
800, mor n mom pro sub I adv real dadj LY aux be S 
801, gra LINK SU J JCT ROOT PUNCT
802, I really especially for the last several weeks have been really
803, miserable here 
804, mor pro sub I adv real dadj LY adv especial dadj LY prep for
805, det art the adj last qn several n week PL v have cop be P STP
806, adv real dadj LY adj miserable adv here 
807, gra SU J JCT ROOT JCT DET MOD QU NT
808, PO J ENUM COMP JCT PRED JCT
809, PUNCT
810, mhm 
811, mor co yes 
812, gra INCROOT PUNCT
813, really 
814, mor adv real dadj LY 
815, gra INCROOT PUNCT
816, smacks lips well I m sorry you ve been so miserable but boy it
817, sure reinforces your decision doesn t it 
818, mor co well pro sub I cop be S adj sorry pro per you aux have
819, cop be P STP adv so adj miserable conj but n boy pro per it adj sure
820, v reinforce S det poss your n decision mod do S neg not pro per it
821, 
822, gra COM SU J ROOT PRED SU J UX CMOD
823, JCT PRED CONJ COORD O J PRED
824, CMOD MOD SU J UX NEG O J
825, PUNCT
826, yeah seriously 
827, mor co yeah adv serious dadj LY 
828, gra INCROOT JCT PUNCT
829, mhm 
830, mor co yes 
831, gra INCROOT PUNCT
832, so I m really glad you guys convinced me to move 
833, mor adv so pro sub I aux be S adv real dadj LY adj glad pro per you
834, n guy PL v convince P ST pro obj me inf to v move 
835, gra JCT SU J UX JCT LINK MOD SU J ROOT
836, O J INF COMP PUNCT
837, End
838,
