,0
655, mor pro sub I v think P ST det art the n boss aux be P ST S neg not
656, part like P STP 
657, gra SU J ROOT DET SU J UX NEG COMP
658, PUNCT
659, well he s not but I mean he s trying to I think he what he s trying
660, to do is set things up before things fall really 
661, mor co well pro sub he aux be S neg not conj but pro sub I v mean
662, pro sub he aux be S part try PRESP prep to pro sub I v think
663, pro sub he pro int what pro sub he aux be S part try PRESP inf to
664, v do cop be S n set n thing PL adv up prep before n thing PL v fall
665, adv real dadj LY 
666, gra COM SU J UX NEG LINK SU J CJCT
667, SU J UX COMP JCT SU J ROOT
668, O J LINK SU J UX COMP INF
669, COMP O J MOD PRED JCT LINK
670, SU J CMOD JCT PUNCT
671, uhhuh oh that s smart 
672, mor co uhhuh co oh pro dem that cop be S adj smart 
673, gra COM COM SU J ROOT PRED PUNCT
674, and so Matt is kind of psyched because I mean things are cra oh
675, and they ve been told that they have to fire one professional and
676, one secretary 
677, mor coord and adv so n prop Matt aux be S adj kind prep of
678, part psyche P STP conj because pro sub I v mean n thing PL
679, aux be PRES co oh coord and pro sub they aux have aux be P STP
680, part tell P STP pro rel that pro sub they v have inf to n fire
681, pro indef one n professional coord and det num one n secretary 
682, gra LINK JCT SU J ROOT PRED JCT PO J
683, LINK SU J CJCT SU J COMP PRED
684, LINK SU J UX UX CJCT LINK
685, SU J CMOD INF COMP ENUM O J
686, CONJ QU NT COORD PUNCT
687, really 
688, mor adv real dadj LY 
689, gra INCROOT PUNCT
690, End
691,
