,0
0,Media audio
1, breathes smacks lips well I m taking a class breathes 
2, mor co well pro sub I aux be S part take PRESP det art a n class 
3, gra COM SU J UX ROOT DET O J PUNCT
4, in 
5, mor adv in 
6, gra INCROOT PUNCT
7, um physical anthropology 
8, mor adj physical n anthropology 
9, gra MOD INCROOT PUNCT
10, smacks lips I applied here s the whole story 
11, mor pro sub I v apply P ST pro exist here cop be S det art the
12, adj whole n story 
13, gra SU J ROOT SU J COMP DET MOD PRED
14, PUNCT
15, this is breathes uh first let me give you the whole rundown of
16, why I didn t call you earlier breathes 
17, mor pro dem this cop be S adv first v let ZERO pro obj me v give
18, pro per you det art the n whole n rundown prep of adv int why
19, pro sub I mod do P ST neg not v call pro per you adj early CP 
20, gra SU J ROOT JCT PRED O J COMP O J 
21, DET MOD O J NJCT LINK SU J
22, UX NEG CPO J SU J JCT PUNCT
23, channel noise blowing nose 
24, in case your 
25, mor prep in n case det poss your 
26, gra INCROOT MOD PO J PUNCT
27, family didn t tell me breathes 
28, mor n family mod do P ST neg not v tell pro obj me 
29, gra SU J UX NEG ROOT O J PUNCT
30, barks hm breathes 
31, breathes I I didn t have your phone number 
32, mor pro sub I pro sub I mod do P ST neg not v have det poss your
33, n phone v number 
34, gra SU J SU J UX NEG ROOT MOD SU J
35, COMP PUNCT
36, oh so that s silly laughs 
37, mor co oh co so pro dem that cop be S adj silly 
38, gra COM COM SU J ROOT PRED PUNCT
39, yeah channel noise 
40, mor co yeah 
41, gra INCROOT PUNCT
42, how did you get it 
43, mor adv int how mod do P ST pro per you v get pro per it 
44, gra LINK UX SU J ROOT O J PUNCT
45, well I called your family 
46, mor co well pro sub I v call P ST det poss your n family 
47, gra COM SU J ROOT MOD O J PUNCT
48, oh 
49, mor co oh 
50, gra INCROOT PUNCT
51, and then 
52, mor coord and adv tem then 
53, gra LINK INCROOT PUNCT
54, they have it 
55, mor pro sub they v have pro per it 
56, gra SU J ROOT O J PUNCT
57, breathes channel noise 
58, laughs 
59, and then they had it breathes 
60, mor coord and adv tem then pro sub they v have P ST pro per it 
61, gra LINK JCT SU J ROOT O J PUNCT
62, channel noise yeah 
63, mor co yeah 
64, gra INCROOT PUNCT
65, and then 
66, mor coord and adv tem then 
67, gra LINK INCROOT PUNCT
68, mhm 
69, mor co yes 
70, gra INCROOT PUNCT
71, en s 
72, mor n prop en poss s 
73, gra INCROOT POSS PUNCT
74, breathes 
75, uh father and sister came for a few days 
76, mor n father coord and n sister v come P ST prep for det art a qn few
77, n day PL 
78, gra SU J CONJ COORD ROOT JCT DET QU NT
79, PO J PUNCT
80, uh 
81, mhm 
82, mor co yes 
83, gra INCROOT PUNCT
84, um 
85, and 
86, mor coord and 
87, gra INCROOT PUNCT
88, so I couldn t really stay up late and call and I couldn t 
89, mor co so pro sub I mod could neg not adv real dadj LY cop stay adv up
90, adj late coord and n call coord and pro sub I mod could neg not 
91, gra COM SU J UX NEG JCT ROOT JCT PRED
92, CONJ COORD LINK SU J UX NEG
93, PUNCT
94, get up early and call 
95, mor v get adv up adj early coord and n call 
96, gra ROOT JCT JCT CONJ COORD PUNCT
97, mhm mhm 
98, mor co yes co yes 
99, gra COM INCROOT PUNCT
100, and there wasn t 
101, mor coord and adv there cop be P ST S neg not 
102, gra LINK SU J ROOT NEG PUNCT
103, you have to entertain and breathes 
104, mor pro per you v have inf to v entertain coord and 
105, gra SU J ROOT INF COMP CONJ PUNCT
106, channel noise 
107, you know Rachel is like being on the couch downstairs and 
108, mor pro per you v know n prop Rachel cop be S co like
109, n gerund be PRESP prep on det art the n couch adv downstairs
110, coord and 
111, gra SU J ROOT SU J COMP COM PRED JCT
112, DET PO J JCT COORD PUNCT
113, lipsmacks 
114, mm laughs 
115, so 
116, mor co so 
117, gra INCROOT PUNCT
118, and then previous word spoken with a laugh and then I couldn t
119, find your number 
120, mor coord and adv tem then coord and adv tem then pro sub I
121, mod could neg not v find det poss your v number 
122, gra LINK JCT LINK JCT SU J UX NEG ROOT
123, MOD COMP PUNCT
124, laughs 
125, breathes and then this whole thing with the classes happened and
126, let me c and then I couldn t get up in the morning because I knew
127, that you were on 
128, mor coord and adv tem then pro dem this adj whole n thing prep with
129, det art the n class PL v happen P ST coord and v let ZERO pro obj me
130, coord and adv tem then pro sub I mod could neg not v get adv up
131, prep in det art the n morning conj because pro sub I v know P ST
132, pro rel that pro per you cop be P ST prep on 
133, gra LINK JCT DET MOD SU J NJCT DET PO J
134, ROOT CONJ COORD O J CONJ JCT
135, SU J UX NEG COORD JCT JCT
136, DET PO J LINK SU J CJCT LINK
137, SU J COMP JCT PUNCT
138, doing classes and stuff and like you would get up and go to work in
139, the morning so I couldn t call you 
140, mor part do PRESP n class PL coord and n stuff coord and co like
141, pro per you mod will COND v get adv up coord and v go inf to v work
142, prep in det art the n morning co so pro sub I mod could neg not
143, v call pro per you 
144, gra XJCT O J CONJ COORD CONJ COM SU J
145, UX COORD JCT CONJ COORD INF
146, COMP JCT DET PO J COM SU J
147, UX NEG ROOT O J PUNCT
148, at night I would have to get up early and call you and I just
149, couldn t get up last three words spoken with a laugh 
150, mor prep at n night pro sub I mod will COND v have inf to v get adv up
151, adv early coord and v call pro per you coord and pro sub I adv just
152, mod could neg not v get adv up 
153, gra JCT PO J SU J UX SU J INF COMP
154, JCT JCT CONJ COORD O J LINK
155, SU J JCT UX NEG ROOT JCT
156, PUNCT
157, laughs 
158, breathes 
159, laughs 
160, and then that whole thing in the class like I applied for the
161, graduate level 
162, mor coord and adv tem then pro dem that adj whole n thing prep in
163, det art the n class co like pro sub I v apply P ST prep for
164, det art the adj graduate n level 
165, gra LINK JCT DET MOD JCT NJCT DET
166, PO J COM SU J ROOT JCT DET MOD
167, PO J PUNCT
168, xxx 
169, uhhuh 
170, mor co uhhuh 
171, gra INCROOT PUNCT
172, right and I went and I talked to them and I said xxx you know like
173, what 
174, mor adv right coord and pro sub I v go P ST coord and pro sub I
175, v talk P ST prep to pro obj them coord and pro sub I v say P ST
176, pro per you v know prep like pro int what 
177, gra JCT LINK SU J ROOT LINK SU J CJCT
178, JCT PO J LINK SU J CJCT SU J
179, COMP JCT PO J PUNCT
180, what are you looking for breathes and they said basically what
181, we re looking for is that you don t embarrass us 
182, mor pro int what aux be PRES pro per you part look PRESP prep for
183, coord and pro sub they v say P ST adv basic dadj L LY pro int what
184, pro sub we aux be PRES part look PRESP prep for cop be S
185, pro rel that pro per you mod do neg not v embarrass pro obj us 
186, gra LINK UX SU J ROOT JCT LINK SU J
187, CPO J JCT LINK SU J UX CPO J
188, JCT PO J LINK SU J UX NEG
189, CMOD O J PUNCT
190, you know 
191, mor pro per you v know 
192, gra SU J ROOT PUNCT
193, you don t embarrass us 
194, mor pro per you mod do neg not v embarrass pro obj us 
195, gra SU J UX NEG ROOT O J PUNCT
196, right so I was like 
197, mor adv right conj so pro sub I cop be P ST S prep like 
198, gra JCT LINK SU J ROOT JCT PUNCT
199, what the hell who were you talking to who were you talking to 
200, mor pro int what det art the n hell pro rel who cop be P ST pro per you
201, part talk PRESP prep to pro rel who cop be P ST pro per you
202, part talk PRESP prep to 
203, gra INCROOT DET O J LINK CMOD PRED XMOD
204, JCT LINK PO J PRED XMOD JCT
205, PUNCT
206, okay 
207, mor co okay 
208, gra INCROOT PUNCT
209, eh to the it s like the college of general studies 
210, mor prep to det art the pro per it cop be S conj like det art the
211, n college prep of n general n study PL 
212, gra INCROOT DET PO J CPO J PRED DET O J
213, NJCT MOD PO J PUNCT
214, uhhuh 
215, mor co uhhuh 
216, gra INCROOT PUNCT
217, it s like sort of the night school and they have this program where
218, you can take four 
219, mor pro per it cop be S conj like n sort prep of det art the n night
220, n school coord and pro sub they v have pro dem this n program
221, pro rel where pro per you mod can v take det num four 
222, gra SU J ROOT CONJ COORD NJCT DET MOD
223, PO J LINK SU J CJCT DET O J
224, LINK SU J UX CMOD O J PUNCT
225, graduate courses 
226, mor n graduate n course PL 
227, gra MOD INCROOT PUNCT
228, uhhuh 
229, mor co uhhuh 
230, gra INCROOT PUNCT
231, and pay like the reduced price in my case I don t pay anything
232, because 
233, mor coord and v pay prep like det art the part reduce P STP n price
234, prep in det poss my n case pro sub I mod do neg not v pay
235, pro indef anything conj because 
236, gra LINK ROOT JCT DET XJCT O J JCT MOD
237, PO J SU J UX NEG PO J O J JCT
238, PUNCT
239, mhm 
240, mor co yes 
241, gra INCROOT PUNCT
242, of the benefits breathes 
243, mor prep of det art the n benefit PL 
244, gra INCROOT DET PO J PUNCT
245, and um and then if you enroll in the program it s there 
246, mor coord and coord and adv tem then conj if pro per you v enroll
247, prep in det art the n program pro per it cop be S adv there 
248, gra LINK LINK JCT LINK SU J CJCT JCT
249, DET PO J SU J ROOT JCT PUNCT
250, so you know and it s like 
251, mor co so pro per you v know coord and pro per it aux be S co like 
252, gra COM SU J ROOT LINK SU J COMP COM
253, PUNCT
254, I I it can I it serves for graduate school as like a stepping
255, stone to get into the program 
256, mor pro per it mod can pro per it v serve S prep for n graduate
257, n school prep as prep like det art a n gerund step PRESP n stone
258, inf to v get prep into det art the n program 
259, gra SU J UX SU J ROOT JCT MOD PO J JCT
260, JCT DET MOD PO J INF XJCT JCT
261, DET PO J PUNCT
262, channel noise uhhuh channel noise 
263, mor co uhhuh 
264, gra INCROOT PUNCT
265, like you know that you don t have it s not 
266, mor prep like pro per you v know pro rel that pro per you
267, mod do neg not v have pro per it cop be S neg not 
268, gra LINK SU J ROOT LINK SU J UX NEG
269, COMP SU J COMP NEG PUNCT
270, as rigorous an application process and all that 
271, mor prep as adj rigorous det art a n application n process coord and
272, qn all pro dem that 
273, gra INCROOT MOD DET MOD PO J CONJ QU NT
274, COORD PUNCT
275, mhm 
276, mor co yes 
277, gra INCROOT PUNCT
278, stuff 
279, mor n stuff 
280, gra INCROOT PUNCT
281, mhm mhm 
282, mor co yes co yes 
283, gra COM INCROOT PUNCT
284, right so 
285, mor adv right adv so 
286, gra JCT INCROOT PUNCT
287, you don t embarrass us and then they were like what s your grade
288, point average and I told them they were like well that sounds 
289, mor pro per you mod do neg not v embarrass pro obj us coord and
290, adv tem then pro sub they cop be P ST co like pro int what cop be S
291, det poss your n grade n point n average coord and pro sub I
292, v tell P ST pro obj them pro sub they cop be P ST co like n well
293, pro rel that n sound PL 
294, gra SU J UX NEG ROOT O J LINK JCT SU J
295, CJCT COM SU J PRED MOD MOD
296, MOD PRED LINK SU J CJCT O J
297, SU J COMP COM PRED LINK CMOD
298, PUNCT
299, about like what we re looking for dadadada b 
300, mor adv about prep like pro int what pro sub we aux be PRES
301, part look PRESP prep for bab dadadada 
302, gra INCROOT JCT LINK SU J UX CPO J JCT
303, PO J PUNCT
304, you don t embarrass us 
305, mor pro per you mod do neg not v embarrass pro obj us 
306, gra SU J UX NEG ROOT O J PUNCT
307, I know breathes 
308, mor pro sub I v know 
309, gra SU J ROOT PUNCT
310, kiss my butt laughs 
311, mor v kiss det poss my n butt 
312, gra ROOT MOD O J PUNCT
313, so then 
314, mor adv so adv tem then 
315, gra JCT INCROOT PUNCT
316, breathes channel noise 
317, I get this letter we re sorry you have not been accepted to the
318, graduate level 
319, mor pro sub I v get pro dem this n letter pro sub we aux be PRES
320, adj sorry pro per you v have neg not aux be P STP part accept P STP
321, prep to det art the adj graduate n level 
322, gra SU J ROOT DET O J SU J UX POSTMOD
323, SU J CMOD NEG UX COMP JCT DET
324, MOD PO J PUNCT
325, channel noise oh no why 
326, mor co oh co no adv int why 
327, gra COM COM ROOT PUNCT
328, you have been accepted for the undergraduate and I m like I was
329, devastated 
330, mor pro per you v have aux be P STP part accept P STP prep for
331, det art the adj undergraduate coord and pro sub I aux be S
332, conj like pro sub I aux be P ST S part devastate P STP 
333, gra SU J ROOT UX COMP JCT DET PO J
334, CONJ SU J UX LINK SU J UX
335, COORD PUNCT
336, oh no 
337, mor co oh co no 
338, gra COM INCROOT PUNCT
339, I was devastated 
340, mor pro sub I aux be P ST S part devastate P STP 
341, gra SU J UX ROOT PUNCT
342, I m sorry honey 
343, mor pro sub I cop be S adj sorry n honey 
344, gra SU J ROOT MOD PRED PUNCT
345, yeah well it then I went in I was like I went in to work and I m
346, like loud breath laughs 
347, mor co yeah adv well pro per it adv tem then pro sub I v go P ST adv in
348, pro sub I aux be P ST S co like pro sub I v go P ST adv in inf to
349, v work coord and pro sub I cop be S prep like 
350, gra COM JCT SU J JCT SU J ROOT JCT
351, SU J UX COM SU J COMP JCT INF
352, XJCT LINK SU J CJCT JCT PUNCT
353, laughs 
354, laughs at work spoken while laughing breathes 
355, mor prep at n work 
356, gra INCROOT PO J PUNCT
357, laughs 
358, and um one of my coworkers was like look 
359, mor coord and det num one prep of det poss my n coworker PL
360, cop be P ST S prep like co look 
361, gra LINK SU J NJCT MOD PO J ROOT JCT
362, PO J PUNCT
363, if what ha what probably happened is they didn t like the classes
364, that you had 
365, mor conj if pro int what det int what adv probable dadj LY
366, part happen P STP cop be S pro sub they mod do P ST neg not co like
367, det art the n class PL pro rel that pro per you part have P STP 
368, gra LINK LINK LINK JCT SU J ROOT SU J
369, UX NEG PRED DET O J LINK SU J
370, CMOD PUNCT
371, breathes and they wanted you to have particular classes that they
372, deemed appropriate 
373, mor coord and pro sub they v want P ST pro per you inf to v have
374, n particular n class PL pro rel that pro sub they v deem P ST
375, adj appropriate 
376, gra LINK SU J ROOT O J INF XMOD MOD O J
377, LINK SU J CMOD JCT PUNCT
378, mm breathes 
379, bingo it s all like 
380, mor n bingo pro per it cop be S adv all prep like 
381, gra JCT SU J ROOT JCT JCT PUNCT
382, great 
383, mor adj great 
384, gra INCROOT PUNCT
385, cultural anthropology that I ve had 
386, mor adj cultural n anthropology pro rel that pro sub I aux have
387, part have P STP 
388, gra MOD INCROOT LINK SU J UX CMOD PUNCT
389, uhhuh 
390, mor co uhhuh 
391, gra INCROOT PUNCT
392, breathes 
393, channel noise 
394, no physical anthropology no archaeology breathes 
395, mor qn no adj physical n anthropology qn no n archaeology 
396, gra QU NT MOD INCROOT QU NT O J PUNCT
397, uhhuh 
398, mor co uhhuh 
399, gra INCROOT PUNCT
400, and I went and I went in and I talked to them and they were like
401, eh you kn you know they said that that s what it was I was like
402, previous three words whispered 
403, mor coord and pro sub I v go P ST coord and pro sub I v go P ST prep in
404, coord and pro sub I v talk P ST prep to pro obj them coord and
405, pro sub they aux be P ST co like pro per you pro per you v know
406, pro sub they v say P ST pro rel that pro dem that cop be S
407, pro int what pro per it cop be P ST S pro sub I cop be P ST S
408, prep like 
409, gra LINK SU J ROOT LINK SU J CJCT JCT
410, LINK SU J CPO J JCT PO J CONJ
411, SU J UX COM SU J SU J COORD
412, SU J COMP LINK SU J COMP LINK
413, SU J PRED SU J COMP JCT PUNCT
414, uh ah 
415, channel noise meanwhile I had like 
416, mor adv meanwhile pro sub I v have P ST co like 
417, gra JCT SU J ROOT COM PUNCT
418, channel noise 
419, spent the night crying previous word spoken while laughing 
420, laughs 
421, mor v spend P ST det art the n night part cry PRESP 
422, gra ROOT DET O J XJCT PUNCT
423, laughs going I m not good enough they don t like me laughs 
424, mor part go PRESP pro sub I cop be S neg not adj good adv enough
425, pro sub they mod do neg not v like pro obj me 
426, gra LINK SU J SU J NEG PRED JCT SU J
427, UX NEG ROOT O J PUNCT
428, breathes it was horrible I was like fuck that 
429, mor pro per it cop be P ST S adj horrible pro sub I cop be P ST S
430, prep like v fuck pro dem that 
431, gra SU J ROOT PRED SU J CJCT JCT PRED
432, O J PUNCT
433, breathes 
434, oh 
435, mor co oh 
436, gra INCROOT PUNCT
437, ugh 
438, mor co ugh 
439, gra INCROOT PUNCT
440, breathes I felt terrible 
441, mor pro sub I v feel P ST adj terrible 
442, gra SU J ROOT JCT PUNCT
443, yeah you should 
444, mor co yeah pro per you mod should 
445, gra COM SU J ROOT PUNCT
446, never believe that you are such a good student 
447, mor adv never v believe pro rel that pro per you cop be PRES qn such
448, det art a adj good n student 
449, gra JCT ROOT LINK SU J COMP QU NT DET
450, MOD PRED PUNCT
451, smacks lips channel noise 
452, I mean even at Earlham you were a good student 
453, mor pro sub I v mean adv even prep at n prop Earlham pro per you
454, cop be P ST det art a adj good n student 
455, gra SU J ROOT JCT JCT PO J SU J CJCT
456, DET MOD PRED PUNCT
457, you got 
458, mor pro per you v get P ST 
459, gra SU J ROOT PUNCT
460, I know 
461, mor pro sub I v know 
462, gra SU J ROOT PUNCT
463, good stuff going for you you know 
464, mor adj good n stuff part go PRESP prep for pro per you pro per you
465, v know 
466, gra MOD SU J XJCT JCT PO J SU J ROOT
467, PUNCT
468, channel noise well it s just like this like after being out of it
469, for a year 
470, mor n well pro per it aux be S adj just v like pro dem this conj like
471, prep after n being adv out prep of pro per it prep for det art a
472, n year 
473, gra LINK SU J UX JCT ROOT O J PUNCT
474, INCROOT PO J JCT JCT PO J JCT
475, DET PO J PUNCT
476, channel noise 
477, and uh 
478, mor coord and 
479, gra INCROOT PUNCT
480, it s not something you lose laughs 
481, mor pro per it cop be S neg not pro indef something pro per you v lose
482, 
483, gra SU J ROOT NEG PRED SU J CMOD PUNCT
484, oh I feel like laughs I have 
485, mor co oh pro sub I v feel conj like pro sub I v have 
486, gra COM SU J ROOT LINK SU J CJCT PUNCT
487, laughs I mean your brain 
488, mor pro sub I v mean det poss your n brain 
489, gra SU J ROOT MOD O J PUNCT
490, breathes feel like I m getting channel 
491, mor v feel conj like pro sub I aux be S part get PRESP 
492, gra ROOT LINK SU J UX CJCT PUNCT
493, I feel like I m getting stupid laughs 
494, mor pro sub I v feel conj like pro sub I aux be S part get PRESP
495, adj stupid 
496, gra SU J ROOT LINK SU J UX COMP PRED
497, PUNCT
498, breathes xxx 
499, may have to like take it out and polish it once in a while to keep
500, it up to date 
501, mor mod may v have inf to co like v take pro per it adv out coord and
502, v polish pro per it adv once prep in det art a n while inf to v keep
503, pro per it adv up prep to n date 
504, gra UX ROOT INF COM COMP O J JCT CONJ
505, COORD O J JCT JCT DET PO J INF
506, COMP O J JCT JCT PO J PUNCT
507, channel noise yeah yeah 
508, mor co yeah co yeah 
509, gra COM INCROOT PUNCT
510, but laughs 
511, mor conj but 
512, gra INCROOT PUNCT
513, yeah 
514, mor co yeah 
515, gra INCROOT PUNCT
516, still there laughs 
517, mor adv still adv there 
518, gra JCT INCROOT PUNCT
519, smacks lips breathes so but I I mean like it r I mean it
520, really hurt 
521, mor adv so conj but pro sub I pro sub I v mean prep like pro per it
522, pro sub I v mean pro per it adv real dadj LY v hurt ZERO 
523, gra JCT LINK SU J SU J ROOT JCT PO J
524, SU J CJCT O J JCT COMP PUNCT
525, channel noise 
526, oh honey I m sorry 
527, mor co oh co honey pro sub I cop be S adj sorry 
528, gra COM COM SU J ROOT PRED PUNCT
529, it really hurt 
530, mor pro per it adv real dadj LY v hurt ZERO 
531, gra SU J JCT ROOT PUNCT
532, but I m fine now because I know that they re just it s just because
533, they re snobs laughs 
534, mor conj but pro sub I cop be S adj fine adv now conj because
535, pro sub I v know pro rel that pro sub they aux be PRES adv just
536, pro per it aux be S adj just conj because pro sub they cop be PRES
537, n snob PL 
538, gra LINK SU J ROOT PRED JCT LINK SU J
539, CJCT LINK SU J UX JCT SU J
540, UX COMP LINK SU J CMOD PRED
541, PUNCT
542, mm laughs 
543, laughs 
544, laughs well that s what you get living in Philadelphia girl
545, laughs 
546, mor co well pro dem that cop be S pro int what pro per you v get
547, part live PRESP prep in n prop Philadelphia n girl 
548, gra COM SU J ROOT LINK SU J PRED XJCT
549, JCT MOD PO J PUNCT
550, channel noise 
551, laughs it doesn t have to do with Philadelphia it has to do with
552, the university of Pennsylvania being an ivy league distortion 
553, school 
554, mor pro per it mod do S neg not v have inf to v do prep with
555, n prop Philadelphia pro per it aux have S inf to v do prep with
556, det art the n university prep of n prop Pennsylvania
557, n gerund be PRESP det art a n ivy n league n school 
558, gra SU J UX NEG ROOT INF COMP JCT PO J
559, SU J UX INF COMP JCT DET
560, PO J NJCT PO J NJCT DET MOD
561, MOD O J PUNCT
562, e exactly 
563, mor adv exact dadj LY 
564, gra INCROOT PUNCT
565, channel noise 
566, exactly that s what you get for living in Philadelphia 
567, mor adv exact dadj LY pro dem that cop be S pro int what pro per you
568, v get prep for n gerund live PRESP prep in n prop Philadelphia 
569, gra JCT SU J ROOT LINK SU J PRED JCT
570, PO J JCT PO J PUNCT
571, xxx 
572, mm being around ivy league schools man 
573, mor n gerund be PRESP prep around n ivy n league n school PL n man 
574, gra INCROOT JCT MOD MOD MOD PO J PUNCT
575, laughs breathes coughs 
576, channel noise 
577, breathes coughs there are a couple of different places I could
578, live where that would breathes you know I could be at 
579, mor adv there cop be PRES det art a n couple prep of adj different
580, n place PL pro sub I mod could v live pro rel where pro dem that
581, mod will COND pro per you v know pro sub I mod could cop be prep at
582, 
583, gra SU J ROOT DET PRED NJCT MOD PO J
584, SU J UX CMOD LINK SU J UX
585, SU J COMP SU J UX COMP JCT
586, PUNCT
587, channel noise 
588, temple which is not eh an ivy league school 
589, mor n temple pro rel which cop be S neg not det art a n ivy n league
590, n school 
591, gra INCROOT LINK CMOD NEG DET MOD MOD
592, PRED PUNCT
593, laughs 
594, breathes 
595, that s true breathes 
596, mor pro dem that cop be S adj true 
597, gra SU J ROOT PRED PUNCT
598, channel noise 
599, but 
600, mor conj but 
601, gra INCROOT PUNCT
602, so 
603, mor co so 
604, gra INCROOT PUNCT
605, you live in Philadelphia so breathes you re going to go to
606, university of Penn laughs
607, from you re to Penn spoken with a laugh 
608, mor pro per you v live prep in n prop Philadelphia conj so
609, pro per you aux be PRES part go PRESP inf to v go prep to
610, n university prep of n prop Penn 
611, gra SU J ROOT JCT PO J LINK SU J UX
612, CJCT INF COMP JCT PO J NJCT
613, PO J PUNCT
614, channel noise 
615, laughs breathes 
616, channel noise 
617, mhm so 
618, mor co yes co so 
619, gra COM INCROOT PUNCT
620, but that s that s my major story channel noise 
621, mor conj but pro dem that cop be S pro rel that cop be S det poss my
622, n major n story 
623, gra LINK SU J ROOT LINK COMP MOD MOD
624, PRED PUNCT
625, that s the story so now you re in this physical anthropology class
626, 
627, mor pro dem that cop be S det art the n story adv so adv now
628, pro per you cop be PRES prep in pro dem this adj physical
629, n anthropology n class 
630, gra SU J ROOT DET JCT JCT NJCT SU J
631, PRED JCT DET MOD MOD PO J PUNCT
632, yeah which is r I was kind of like okay it s going to be really
633, scientific and breathes 
634, mor co yeah pro int which cop be S pro sub I aux be P ST S adj kind
635, prep of co like adj okay pro per it aux be S part go PRESP inf to
636, cop be adv real dadj LY adj scientific coord and 
637, gra COM SU J ROOT SU J UX PRED JCT
638, COM MOD SU J UX CPO J INF
639, COMP JCT PRED CONJ COORD
640, hm channel noise 
641, End
642,
